{
  "contract_schema": 1,
  "contract_name": "domain-events-v1",
  "contract_version": 1,
  "namespace": "gridopoly.domain_events.v1",
  "definitions": [
    {
      "id": 1,
      "name": "room_created",
      "stable_name": "ROOM_CREATED",
      "critical": true,
      "terminal_role": "NONE",
      "visibility": "PUBLIC",
      "description": "Domain event ROOM_CREATED.",
      "kind": "EVENT",
      "fields": [
        {
          "id": 1,
          "name": "room_id",
          "type": "U64",
          "cardinality": "ONE",
          "required": true,
          "critical": true,
          "private": false,
          "visibility": "PUBLIC",
          "sort": "FIELD_ID",
          "range": {
            "min": 1,
            "max": 18446744073709551614
          }
        },
        {
          "id": 2,
          "name": "room_seed",
          "type": "U64",
          "cardinality": "ONE",
          "required": true,
          "critical": true,
          "private": false,
          "visibility": "PUBLIC",
          "sort": "FIELD_ID",
          "range": {
            "min": 0,
            "max": 18446744073709551615
          }
        },
        {
          "id": 3,
          "name": "mode",
          "type": "U8",
          "cardinality": "ONE",
          "required": true,
          "critical": true,
          "private": false,
          "visibility": "PUBLIC",
          "sort": "FIELD_ID",
          "range": {
            "min": 1,
            "max": 3
          },
          "enum": [
            {
              "name": "TEST",
              "value": 1
            },
            {
              "name": "DEMO",
              "value": 2
            },
            {
              "name": "STANDARD",
              "value": 3
            }
          ]
        },
        {
          "id": 4,
          "name": "disconnect_policy",
          "type": "U8",
          "cardinality": "ONE",
          "required": true,
          "critical": true,
          "private": false,
          "visibility": "PUBLIC",
          "sort": "FIELD_ID",
          "range": {
            "min": 1,
            "max": 3
          },
          "enum": [
            {
              "name": "PAUSE",
              "value": 1
            },
            {
              "name": "BOT_TAKEOVER",
              "value": 2
            },
            {
              "name": "WEB_ADMIN",
              "value": 3
            }
          ]
        },
        {
          "id": 5,
          "name": "map_id",
          "type": "UTF8",
          "cardinality": "ONE",
          "required": true,
          "critical": true,
          "private": false,
          "visibility": "PUBLIC",
          "sort": "FIELD_ID",
          "max": 32
        },
        {
          "id": 6,
          "name": "map_revision",
          "type": "U16",
          "cardinality": "ONE",
          "required": true,
          "critical": true,
          "private": false,
          "visibility": "PUBLIC",
          "sort": "FIELD_ID",
          "range": {
            "min": 1,
            "max": 65534
          }
        },
        {
          "id": 7,
          "name": "economy_id",
          "type": "UTF8",
          "cardinality": "ONE",
          "required": true,
          "critical": true,
          "private": false,
          "visibility": "PUBLIC",
          "sort": "FIELD_ID",
          "max": 40
        },
        {
          "id": 8,
          "name": "content_manifest_hash",
          "type": "BYTES",
          "cardinality": "ONE",
          "required": true,
          "critical": true,
          "private": false,
          "visibility": "PUBLIC",
          "sort": "FIELD_ID",
          "max": 32
        }
      ]
    },
    {
      "id": 2,
      "name": "room_setup_started",
      "stable_name": "ROOM_SETUP_STARTED",
      "critical": true,
      "terminal_role": "NONE",
      "visibility": "PUBLIC",
      "description": "Domain event ROOM_SETUP_STARTED.",
      "kind": "EVENT",
      "fields": [
        {
          "id": 1,
          "name": "setup_rolls",
          "type": "RECORD_LIST",
          "record": "setup_roll_item",
          "cardinality": "MANY",
          "required": true,
          "critical": true,
          "private": false,
          "visibility": "PUBLIC",
          "sort": "ROUND_THEN_SEAT_ID",
          "max": 30
        },
        {
          "id": 2,
          "name": "turn_order",
          "type": "RECORD_LIST",
          "record": "ordered_player_item",
          "cardinality": "MANY",
          "required": true,
          "critical": true,
          "private": false,
          "visibility": "PUBLIC",
          "sort": "ORDINAL",
          "max": 6
        }
      ]
    },
    {
      "id": 3,
      "name": "game_started",
      "stable_name": "GAME_STARTED",
      "critical": true,
      "terminal_role": "NONE",
      "visibility": "PUBLIC",
      "description": "Domain event GAME_STARTED.",
      "kind": "EVENT",
      "fields": [
        {
          "id": 1,
          "name": "round_number",
          "type": "U16",
          "cardinality": "ONE",
          "required": true,
          "critical": true,
          "private": false,
          "visibility": "PUBLIC",
          "sort": "FIELD_ID",
          "range": {
            "min": 1,
            "max": 65534
          }
        },
        {
          "id": 2,
          "name": "active_player_id",
          "type": "U8",
          "cardinality": "ONE",
          "required": true,
          "critical": true,
          "private": false,
          "visibility": "PUBLIC",
          "sort": "FIELD_ID",
          "range": {
            "min": 1,
            "max": 6
          }
        },
        {
          "id": 3,
          "name": "turn_order",
          "type": "RECORD_LIST",
          "record": "ordered_player_item",
          "cardinality": "MANY",
          "required": true,
          "critical": true,
          "private": false,
          "visibility": "PUBLIC",
          "sort": "ORDINAL",
          "max": 6
        }
      ]
    },
    {
      "id": 4,
      "name": "room_resumed",
      "stable_name": "ROOM_RESUMED",
      "critical": true,
      "terminal_role": "NONE",
      "visibility": "PUBLIC",
      "description": "Domain event ROOM_RESUMED.",
      "kind": "EVENT",
      "fields": [
        {
          "id": 1,
          "name": "recovery_generation",
          "type": "U32",
          "cardinality": "ONE",
          "required": true,
          "critical": true,
          "private": false,
          "visibility": "PUBLIC",
          "sort": "FIELD_ID",
          "range": {
            "min": 1,
            "max": 4294967294
          }
        },
        {
          "id": 2,
          "name": "resumed_at_server_ms",
          "type": "U32",
          "cardinality": "ONE",
          "required": true,
          "critical": true,
          "private": false,
          "visibility": "PUBLIC",
          "sort": "FIELD_ID",
          "range": {
            "min": 0,
            "max": 4294967295
          }
        }
      ]
    },
    {
      "id": 5,
      "name": "room_closed",
      "stable_name": "ROOM_CLOSED",
      "critical": true,
      "terminal_role": "NONE",
      "visibility": "PUBLIC",
      "description": "Domain event ROOM_CLOSED.",
      "kind": "EVENT",
      "fields": [
        {
          "id": 1,
          "name": "old_room_id",
          "type": "U64",
          "cardinality": "ONE",
          "required": true,
          "critical": true,
          "private": false,
          "visibility": "PUBLIC",
          "sort": "FIELD_ID",
          "range": {
            "min": 1,
            "max": 18446744073709551614
          }
        },
        {
          "id": 2,
          "name": "resulting_lifecycle",
          "type": "U8",
          "cardinality": "ONE",
          "required": true,
          "critical": true,
          "private": false,
          "visibility": "PUBLIC",
          "sort": "FIELD_ID",
          "range": {
            "min": 2,
            "max": 2
          },
          "enum": [
            {
              "name": "RESET_PREPARED",
              "value": 2
            }
          ]
        }
      ]
    },
    {
      "id": 16,
      "name": "seat_bound",
      "stable_name": "SEAT_BOUND",
      "critical": true,
      "terminal_role": "NONE",
      "visibility": "PUBLIC",
      "description": "Domain event SEAT_BOUND.",
      "kind": "EVENT",
      "fields": [
        {
          "id": 1,
          "name": "player_id",
          "type": "U8",
          "cardinality": "ONE",
          "required": true,
          "critical": true,
          "private": false,
          "visibility": "PUBLIC",
          "sort": "FIELD_ID",
          "range": {
            "min": 1,
            "max": 6
          }
        },
        {
          "id": 2,
          "name": "seat_id",
          "type": "U8",
          "cardinality": "ONE",
          "required": true,
          "critical": true,
          "private": false,
          "visibility": "PUBLIC",
          "sort": "FIELD_ID",
          "range": {
            "min": 1,
            "max": 6
          }
        },
        {
          "id": 3,
          "name": "assignment_version",
          "type": "U32",
          "cardinality": "ONE",
          "required": true,
          "critical": true,
          "private": false,
          "visibility": "PUBLIC",
          "sort": "FIELD_ID",
          "range": {
            "min": 1,
            "max": 4294967294
          }
        },
        {
          "id": 4,
          "name": "presence_generation",
          "type": "U32",
          "cardinality": "ONE",
          "required": true,
          "critical": true,
          "private": false,
          "visibility": "PUBLIC",
          "sort": "FIELD_ID",
          "range": {
            "min": 1,
            "max": 4294967294
          }
        },
        {
          "id": 5,
          "name": "controller_type",